{
  "subject": {
    "type": "single-tree",
    "summary": "A solitary tree against a large quiet sky",
    "identity_anchors": [
      "tree silhouette",
      "trunk position",
      "branch spread",
      "horizon relationship"
    ]
  },
  "environment": "open natural scene with large sky",
  "lighting": [
    "soft-light",
    "overcast"
  ],
  "mood": [
    "quiet",
    "minimal",
    "poetic",
    "isolated"
  ],
  "geometry": [
    "single-form",
    "open-space",
    "silhouette"
  ],
  "palette": [
    "limited",
    "source-derived"
  ],
  "materials": [
    "foliage",
    "bark"
  ],
  "text_safe_zones": [
    "upper-left sky"
  ],
  "realism_value": "medium",
  "transformation_tolerance": "high",
  "user_preferences": {
    "output_ratio": "3:4",
    "typography": "small",
    "hybrid_allowed": true
  }
}
